{
  "id": "toolreq_read_001",
  "run_id": "run_demo",
  "requested_by": "agent.local",
  "capability_ref": "cap_local_file_read@0.1.0",
  "intent": "Read a workspace-scoped file",
  "operation": {
    "verb": "read",
    "target": {
      "kind": "file",
      "uri": "workspace://README.md",
      "label": "README"
    },
    "expected_effect": "Return file contents without modifying workspace state"
  },
  "risk_inputs": {
    "action_type": "read",
    "target_resource": "workspace_file",
    "data_sensitivity": "private",
    "side_effect": "none",
    "reversibility": "high",
    "audience": "local_user",
    "credential_scope": "none",
    "runtime_boundary": "local_workspace",
    "user_intent_strength": "explicit",
    "taint_chain": ["user"],
    "target_confidence": 0.99,
    "blast_radius": "single_file",
    "data_egress_destination": "local_response"
  }
}
